{
  "artifact_type": "patch_stability",
  "contract_version": "1.0.0",
  "status": "success",
  "created_at": "2026-09-15T04:06:36.682006Z",
  "provenance": {
    "run_id": null,
    "provider": null,
    "model": null,
    "document_input": null,
    "source_documents": [],
    "source_artifacts": [
      "outputs/travel_insurance/experiments/schema-gpt55/round_1/consensus/candidate_patches/run_001.json",
      "outputs/travel_insurance/experiments/schema-gpt55/round_1/consensus/candidate_patches/run_002.json",
      "outputs/travel_insurance/experiments/schema-gpt55/round_1/consensus/candidate_patches/run_003.json",
      "outputs/travel_insurance/experiments/schema-gpt55/round_1/consensus/candidate_patches/run_004.json",
      "outputs/travel_insurance/experiments/schema-gpt55/round_1/consensus/candidate_patches/run_005.json"
    ]
  },
  "data": {
    "metadata": {
      "total_runs": 5,
      "stability_source": "candidate_schema_patches"
    },
    "dimensions": {
      "fields": {
        "stable_count": 0,
        "drift_count": 59,
        "union_count": 59,
        "stability": 0.0,
        "stable_items": [],
        "drifting_items": [
          "alternative_or_replacement_staff_limit",
          "available_traveller_cover_types",
          "childcare_or_dependent_care_limit",
          "claim_notification_deadline_days",
          "cover_start_and_end_rules",
          "cover_type_limit_rules",
          "cover_types_available",
          "cruise_cabin_confinement_limit",
          "cruise_cover_minimum_nights_trigger",
          "cruise_formal_wear_limit",
          "cruise_marine_rescue_diversion_limit",
          "cruise_missed_port_limit",
          "cruise_missed_shore_excursion_limit",
          "cruise_ship_to_shore_evacuation_limit",
          "emergency_assistance_approval_threshold_aud",
          "emergency_medical_limit",
          "emergency_medical_preapproval_threshold_aud",
          "extra_territorial_workers_compensation_limit",
          "funeral_or_repatriation_of_remains_limit",
          "hijack_kidnap_and_ransom_limit",
          "hijack_or_hijacking_limit",
          "hijacking_limit",
          "hospital_cash_or_incidentals_limit",
          "identity_theft_protection_limit",
          "inbound_emergency_dental_in_australia_limit",
          "inbound_medical_in_australia_limit",
          "kidnap_ransom_limit",
          "legal_expenses_limit",
          "loss_theft_report_deadline",
          "luggage_delay_minimum_delay_hours",
          "luggage_delay_waiting_period_hours",
          "maximum_trip_duration_options",
          "medical_assistance_approval_threshold_aud",
          "medical_expenses_continuation_limit_months",
          "medical_expenses_max_months_from_onset",
          "medical_treatment_maximum_period_months",
          "missed_connections_limit",
          "natural_disaster_cover_status",
          "pds_version_identifier",
          "personal_vehicle_excess_limit",
          "personal_vehicle_excess_or_repair_limit",
          "pet_care_limit",
          "pets_childcare_and_domestic_services_limit",
          "pets_childcare_domestic_services_limit",
          "policy_extension_terms",
          "repatriation_of_remains_limit",
          "resumption_of_journey_limit",
          "return_rental_vehicle_limit",
          "schengen_repatriation_limit",
          "special_events_limit",
          "specified_item_max_per_item_aud",
          "specified_items_cover_limit",
          "specified_items_or_high_value_items_cover_options",
          "travel_agent_cancellation_fee_limit",
          "travel_delay_minimum_delay_hours",
          "travel_delay_waiting_period_hours",
          "travel_services_provider_insolvency_limit",
          "traveller_party_options",
          "winter_sports_cover_status"
        ]
      }
    }
  },
  "error": null
}
